{
  "$schema": "../schema/AppPreferences.schema.json",
  "appVersion": "1.1.0.1",
  "chatTrigger": false,
  "pointsTrigger": true,
  "bitsTrigger": true,
  "followTrigger": false,
  "subTrigger": true,
  "giftedSubTrigger": true,
  "gifteesGetCasts": true,
  "failable": false,
  "failChance": 0,
  "customMode": true,
  "commandIdent": "!",
  "castCommand": "fish",
  "timeoutDuration": 10,
  "rewardName": "Fish",
  "minimumBits": 1,
  "exactBits": false,
  "multipleCastsBits": true,
  "maxBitCasts": 5,
  "helpCommand": "fishhelp",
  "playerStatsAllowed": true,
  "playerStatsCommand": "fishstats",
  "leaderboardQueue": true,
  "leaderboardCommand": "fishboard",
  "leaderboardTimeoutDuration": 300,
  "leaderboardPlayerSize": 20,
  "leaderboardCatchSize": 20,
  "dexQueue": true,
  "dexCommand": "dex",
  "dexTimeoutDuration": 600,
  "sendChatMessage": false,
  "customChatMessage": false,
  "customChatString": "{user} you caught {rarityarticle} {rarity} {ratingstars} {catch} weighing {weight} worth {gold} gold! You now have {playergold} gold!",
  "castDelay": 0,
  "muted": false,
  "volume": 0.045,
  "catchVolume": 0.8,
  "hideMatureContent": false,
  "transition": true,
  "boostRares": false,
  "modsCanTargetCast": true,
  "modsAreSuperUsers": true,
  "enableSammi": false,
  "sammiPort": 9450,
  "enableSB": true,
  "sbIP": "127.0.0.1",
  "sbPort": 7474,
  "sbCastAction": null,
  "sbCatchAction": null,
  "sbSnagAction": null,
  "sbCatchCompleteAction": null,
  "enableMixitup": false,
  "mixCastWebhook": "",
  "mixSnagWebhook": "",
  "mixCatchWebhook": "",
  "mixCatchCompleteWebhook": "",
  "enableAPI": false,
  "apiPort": 4210,
  "highDetail": true,
  "halloweenDetail": false,
  "quality": 3,
  "resolution": 1,
  "fps": 60,
  "transparency": 1,
  "weatherIndex": 1,
  "shownHalloweenWeather": true,
  "leaderboardStart": "06/01/2024 02:46:18 AM",
  "allTimeLeaderboard": true,
  "askedAboutData": true,
  "dataCollection": false,
  "isDateTimeUpgraded": true
}
